<?xml version="1.0" encoding="UTF-8" ?>
<!DOCTYPE table
[
  <!ELEMENT table	(tuple)*>
  <!ATTLIST table
            name	CDATA #REQUIRED
  >

  <!ELEMENT tuple	(table|tuple|atom)*>
  <!ATTLIST tuple
            name	CDATA #IMPLIED
  >

  <!ELEMENT atom	(#PCDATA)*>
  <!ATTLIST atom
            name	CDATA #REQUIRED
            type	CDATA "text"
            size	CDATA "short"
  >
]
>
<?schema
  table           eevents
    integer         EVE_irn
    text long       EveEventTitle
    table           EVE_SecDepartment_tab
      text short      SecDepartment
    end
    table           MulMultiMediaRef_tab
      integer         MM_irn
      text long       MulIdentifier
      text short      AudAccessURI
      text short      SecRecordStatus
    end
    table           EveAssociatedRecordsRef_tab
      integer         group_irn
      table           Keys_tab
        integer         Keys
      end
      integer         KeysCount
      text short      Module
      text short      GroupName
      table           group_SecDepartment_tab
        text short      SecDepartment
      end
      text short      GroupType
      text long       Query
    end
  end
?>
<!-- Data -->
<table name="eevents">

  <!-- Row 1 -->
  <tuple>
    <atom name="EVE_irn">5459</atom>
    <atom name="EveEventTitle">Animals in Miniature</atom>
    <table name="EVE_SecDepartment_tab">
      <tuple>
        <atom name="SecDepartment">Library</atom>
      </tuple>
      <tuple>
        <atom name="SecDepartment">Photo Archives</atom>
      </tuple>
      <tuple>
        <atom name="SecDepartment">Exhibitions</atom>
      </tuple>
    </table>
    <table name="MulMultiMediaRef_tab">
      <tuple>
        <atom name="MM_irn">2097968</atom>
        <atom name="MulIdentifier">GN78532.jpg</atom>
        <atom name="AudAccessURI">http://fm-digital-assets.fieldmuseum.org/2097/968/GN78532.jpg</atom>
        <atom name="SecRecordStatus">Active</atom>
      </tuple>
      <tuple>
        <atom name="MM_irn">2097969</atom>
        <atom name="MulIdentifier">GN78533.jpg</atom>
        <atom name="AudAccessURI">http://fm-digital-assets.fieldmuseum.org/2097/969/GN78533.jpg</atom>
        <atom name="SecRecordStatus">Active</atom>
      </tuple>
      <tuple>
        <atom name="MM_irn">2097970</atom>
        <atom name="MulIdentifier">GN78534.jpg</atom>
        <atom name="AudAccessURI">http://fm-digital-assets.fieldmuseum.org/2097/970/GN78534.jpg</atom>
        <atom name="SecRecordStatus">Active</atom>
      </tuple>
      <tuple>
        <atom name="MM_irn">2097971</atom>
        <atom name="MulIdentifier">GN78535.jpg</atom>
        <atom name="AudAccessURI">http://fm-digital-assets.fieldmuseum.org/2097/971/GN78535.jpg</atom>
        <atom name="SecRecordStatus">Active</atom>
      </tuple>
      <tuple>
        <atom name="MM_irn">2097972</atom>
        <atom name="MulIdentifier">GN78536.jpg</atom>
        <atom name="AudAccessURI">http://fm-digital-assets.fieldmuseum.org/2097/972/GN78536.jpg</atom>
        <atom name="SecRecordStatus">Active</atom>
      </tuple>
      <tuple>
        <atom name="MM_irn">2097973</atom>
        <atom name="MulIdentifier">GN78537.jpg</atom>
        <atom name="AudAccessURI">http://fm-digital-assets.fieldmuseum.org/2097/973/GN78537.jpg</atom>
        <atom name="SecRecordStatus">Active</atom>
      </tuple>
      <tuple>
        <atom name="MM_irn">2097974</atom>
        <atom name="MulIdentifier">GN78540.jpg</atom>
        <atom name="AudAccessURI">http://fm-digital-assets.fieldmuseum.org/2097/974/GN78540.jpg</atom>
        <atom name="SecRecordStatus">Active</atom>
      </tuple>
      <tuple>
        <atom name="MM_irn">2097975</atom>
        <atom name="MulIdentifier">GN78541.jpg</atom>
        <atom name="AudAccessURI">http://fm-digital-assets.fieldmuseum.org/2097/975/GN78541.jpg</atom>
        <atom name="SecRecordStatus">Active</atom>
      </tuple>
      <tuple>
        <atom name="MM_irn">2098399</atom>
        <atom name="MulIdentifier">GN78542_A_print.jpg</atom>
        <atom name="AudAccessURI">http://fm-digital-assets.fieldmuseum.org/2098/399/GN78542_A_print.jpg</atom>
        <atom name="SecRecordStatus">Active</atom>
      </tuple>
    </table>
  </tuple>

  <!-- Row 2 -->
  <tuple>
    <atom name="EVE_irn">8796</atom>
    <atom name="EveEventTitle">Poetry in Residence Translations</atom>
    <table name="EVE_SecDepartment_tab">
      <tuple>
        <atom name="SecDepartment">Technology</atom>
      </tuple>
      <tuple>
        <atom name="SecDepartment">Exhibitions</atom>
      </tuple>
    </table>
    <table name="MulMultiMediaRef_tab">
      <tuple>
        <atom name="MM_irn">2316048</atom>
        <atom name="MulIdentifier">EX_2021_1_Poetry_Project_text.pdf</atom>
        <atom name="AudAccessURI">http://fm-digital-assets.fieldmuseum.org/2316/048/EX_2021_1_Poetry_Project_text.pdf</atom>
        <atom name="SecRecordStatus">Active</atom>
      </tuple>
      <tuple>
        <atom name="MM_irn">2315982</atom>
        <atom name="MulIdentifier">QR_https_fieldmuseum_io_ElshtainPoemKnown.svg</atom>
        <atom name="AudAccessURI">http://fm-digital-assets.fieldmuseum.org/2315/982/QR_https_fieldmuseum_io_ElshtainPoemKnown.svg</atom>
        <atom name="SecRecordStatus">Active</atom>
      </tuple>
      <tuple>
        <atom name="MM_irn">2316026</atom>
        <atom name="MulIdentifier">QR_https_fieldmuseum_io_ElshtainPoemConnect.svg</atom>
        <atom name="AudAccessURI">http://fm-digital-assets.fieldmuseum.org/2316/026/QR_https_fieldmuseum_io_ElshtainPoemConnect.svg</atom>
        <atom name="SecRecordStatus">Active</atom>
      </tuple>
      <tuple>
        <atom name="MM_irn">2316028</atom>
        <atom name="MulIdentifier">QR_https_fieldmuseum_io_ElshtainPoemLucy.svg</atom>
        <atom name="AudAccessURI">http://fm-digital-assets.fieldmuseum.org/2316/028/QR_https_fieldmuseum_io_ElshtainPoemLucy.svg</atom>
        <atom name="SecRecordStatus">Active</atom>
      </tuple>
      <tuple>
        <atom name="MM_irn">2316030</atom>
        <atom name="MulIdentifier">QR_https_fieldmuseum_io_ElshtainPoemAnimal.svg</atom>
        <atom name="AudAccessURI">http://fm-digital-assets.fieldmuseum.org/2316/030/QR_https_fieldmuseum_io_ElshtainPoemAnimal.svg</atom>
        <atom name="SecRecordStatus">Active</atom>
      </tuple>
      <tuple>
        <atom name="MM_irn">2316032</atom>
        <atom name="MulIdentifier">QR_https_fieldmuseum_io_ElshtainPoemMaximo.svg</atom>
        <atom name="AudAccessURI">http://fm-digital-assets.fieldmuseum.org/2316/032/QR_https_fieldmuseum_io_ElshtainPoemMaximo.svg</atom>
        <atom name="SecRecordStatus">Active</atom>
      </tuple>
      <tuple>
        <atom name="MM_irn">2316034</atom>
        <atom name="MulIdentifier">QR_https_fieldmuseum_io_ElshtainPoemTheNastiest.svg</atom>
        <atom name="AudAccessURI">http://fm-digital-assets.fieldmuseum.org/2316/034/QR_https_fieldmuseum_io_ElshtainPoemTheNastiest.svg</atom>
        <atom name="SecRecordStatus">Active</atom>
      </tuple>
      <tuple>
        <atom name="MM_irn">2316036</atom>
        <atom name="MulIdentifier">QR_https_fieldmuseum_io_ElshtainPoemFrozenZoos.svg</atom>
        <atom name="AudAccessURI">http://fm-digital-assets.fieldmuseum.org/2316/036/QR_https_fieldmuseum_io_ElshtainPoemFrozenZoos.svg</atom>
        <atom name="SecRecordStatus">Active</atom>
      </tuple>
      <tuple>
        <atom name="MM_irn">2316038</atom>
        <atom name="MulIdentifier">QR_https_fieldmuseum_io_ElshtainPoemEye.svg</atom>
        <atom name="AudAccessURI">http://fm-digital-assets.fieldmuseum.org/2316/038/QR_https_fieldmuseum_io_ElshtainPoemEye.svg</atom>
        <atom name="SecRecordStatus">Active</atom>
      </tuple>
      <tuple>
        <atom name="MM_irn">2316040</atom>
        <atom name="MulIdentifier">QR_https_fieldmuseum_io_ElshtainPoemInsects.svg</atom>
        <atom name="AudAccessURI">http://fm-digital-assets.fieldmuseum.org/2316/040/QR_https_fieldmuseum_io_ElshtainPoemInsects.svg</atom>
        <atom name="SecRecordStatus">Active</atom>
      </tuple>
    </table>
  </tuple>

  <!-- Row 3 -->
  <tuple>
    <atom name="EVE_irn">8778</atom>
    <atom name="EveEventTitle">Mapping Philippine Material Culture</atom>
    <table name="EVE_SecDepartment_tab">
      <tuple>
        <atom name="SecDepartment">Anthropology</atom>
      </tuple>
      <tuple>
        <atom name="SecDepartment">Technology</atom>
      </tuple>
    </table>
    <table name="MulMultiMediaRef_tab">
      <tuple>
        <atom name="MM_irn">2312238</atom>
        <atom name="MulIdentifier">h2i_dwc_xml_json_224718638687.zip</atom>
        <atom name="AudAccessURI">http://fm-digital-assets.fieldmuseum.org/2312/238/h2i_dwc_xml_json_224718638687.zip</atom>
        <atom name="SecRecordStatus">Active</atom>
      </tuple>
      <tuple>
        <atom name="MM_irn">2312248</atom>
        <atom name="MulIdentifier">h2i_ac_xml_json_161909193247.zip</atom>
        <atom name="AudAccessURI">http://fm-digital-assets.fieldmuseum.org/2312/248/h2i_ac_xml_json_161909193247.zip</atom>
        <atom name="SecRecordStatus">Active</atom>
      </tuple>
      <tuple>
        <atom name="MM_irn">2315064</atom>
        <atom name="MulIdentifier">Philippines_Datasharing_MOU_20220222___signed_copy.pdf</atom>
        <atom name="AudAccessURI"></atom>
        <atom name="SecRecordStatus">Active</atom>
      </tuple>
      <tuple>
        <atom name="MM_irn">2322720</atom>
        <atom name="MulIdentifier">h2i_dwc_xml_json_105238337206.zip</atom>
        <atom name="AudAccessURI">http://fm-digital-assets.fieldmuseum.org/2322/720/h2i_dwc_xml_json_105238337206.zip</atom>
        <atom name="SecRecordStatus">Active</atom>
      </tuple>
    </table>
    <table name="EveAssociatedRecordsRef_tab">
      <tuple>
        <atom name="group_irn">15036</atom>
        <atom name="KeysCount">0</atom>
        <atom name="Module">ecatalogue</atom>
        <atom name="GroupName">Philippine Heritage Web</atom>
        <atom name="GroupType">Terms</atom>
        <atom name="Query">CatMuseum=Field Museum of Natural History; AdmPublishWebNoPassword=Yes; CatDepartment=Anthropology; CatCatalog=Anthropology; CatProject_tab=\"Philippines Heritage\"</atom>
      </tuple>
      <tuple>
        <atom name="group_irn">15039</atom>
        <table name="Keys_tab">
          <tuple>
            <atom name="Keys">229795</atom>
          </tuple>
          <tuple>
            <atom name="Keys">229796</atom>
          </tuple>
          <tuple>
            <atom name="Keys">229797</atom>
          </tuple>
          <tuple>
            <atom name="Keys">235376</atom>
          </tuple>
          <tuple>
            <atom name="Keys">235796</atom>
          </tuple>
          <tuple>
            <atom name="Keys">236441</atom>
          </tuple>
          <tuple>
            <atom name="Keys">236442</atom>
          </tuple>
          <tuple>
            <atom name="Keys">242220</atom>
          </tuple>
          <tuple>
            <atom name="Keys">243294</atom>
          </tuple>
          <tuple>
            <atom name="Keys">243296</atom>
          </tuple>
          <tuple>
            <atom name="Keys">243305</atom>
          </tuple>
          <tuple>
            <atom name="Keys">281914</atom>
          </tuple>
          <tuple>
            <atom name="Keys">319423</atom>
          </tuple>
          <tuple>
            <atom name="Keys">319424</atom>
          </tuple>
          <tuple>
            <atom name="Keys">320105</atom>
          </tuple>
          <tuple>
            <atom name="Keys">320111</atom>
          </tuple>
          <tuple>
            <atom name="Keys">352595</atom>
          </tuple>
          <tuple>
            <atom name="Keys">361786</atom>
          </tuple>
          <tuple>
            <atom name="Keys">361800</atom>
          </tuple>
          <tuple>
            <atom name="Keys">361801</atom>
          </tuple>
          <tuple>
            <atom name="Keys">361802</atom>
          </tuple>
          <tuple>
            <atom name="Keys">361803</atom>
          </tuple>
          <tuple>
            <atom name="Keys">361804</atom>
          </tuple>
          <tuple>
            <atom name="Keys">361805</atom>
          </tuple>
          <tuple>
            <atom name="Keys">361806</atom>
          </tuple>
          <tuple>
            <atom name="Keys">361807</atom>
          </tuple>
          <tuple>
            <atom name="Keys">361808</atom>
          </tuple>
          <tuple>
            <atom name="Keys">362437</atom>
          </tuple>
          <tuple>
            <atom name="Keys">362438</atom>
          </tuple>
          <tuple>
            <atom name="Keys">362439</atom>
          </tuple>
          <tuple>
            <atom name="Keys">362440</atom>
          </tuple>
          <tuple>
            <atom name="Keys">362443</atom>
          </tuple>
          <tuple>
            <atom name="Keys">362444</atom>
          </tuple>
          <tuple>
            <atom name="Keys">362446</atom>
          </tuple>
          <tuple>
            <atom name="Keys">362447</atom>
          </tuple>
          <tuple>
            <atom name="Keys">362448</atom>
          </tuple>
          <tuple>
            <atom name="Keys">362450</atom>
          </tuple>
          <tuple>
            <atom name="Keys">362451</atom>
          </tuple>
          <tuple>
            <atom name="Keys">362452</atom>
          </tuple>
          <tuple>
            <atom name="Keys">362453</atom>
          </tuple>
          <tuple>
            <atom name="Keys">362454</atom>
          </tuple>
          <tuple>
            <atom name="Keys">362455</atom>
          </tuple>
          <tuple>
            <atom name="Keys">362456</atom>
          </tuple>
          <tuple>
            <atom name="Keys">362457</atom>
          </tuple>
          <tuple>
            <atom name="Keys">362458</atom>
          </tuple>
          <tuple>
            <atom name="Keys">362459</atom>
          </tuple>
          <tuple>
            <atom name="Keys">362460</atom>
          </tuple>
          <tuple>
            <atom name="Keys">362461</atom>
          </tuple>
          <tuple>
            <atom name="Keys">362462</atom>
          </tuple>
          <tuple>
            <atom name="Keys">362463</atom>
          </tuple>
          <tuple>
            <atom name="Keys">362464</atom>
          </tuple>
          <tuple>
            <atom name="Keys">362465</atom>
          </tuple>
          <tuple>
            <atom name="Keys">362466</atom>
          </tuple>
          <tuple>
            <atom name="Keys">362467</atom>
          </tuple>
          <tuple>
            <atom name="Keys">362468</atom>
          </tuple>
          <tuple>
            <atom name="Keys">362470</atom>
          </tuple>
          <tuple>
            <atom name="Keys">362471</atom>
          </tuple>
          <tuple>
            <atom name="Keys">362472</atom>
          </tuple>
          <tuple>
            <atom name="Keys">362473</atom>
          </tuple>
          <tuple>
            <atom name="Keys">362475</atom>
          </tuple>
          <tuple>
            <atom name="Keys">362476</atom>
          </tuple>
          <tuple>
            <atom name="Keys">362478</atom>
          </tuple>
          <tuple>
            <atom name="Keys">362479</atom>
          </tuple>
          <tuple>
            <atom name="Keys">362480</atom>
          </tuple>
          <tuple>
            <atom name="Keys">362481</atom>
          </tuple>
          <tuple>
            <atom name="Keys">362482</atom>
          </tuple>
          <tuple>
            <atom name="Keys">362483</atom>
          </tuple>
          <tuple>
            <atom name="Keys">362484</atom>
          </tuple>
          <tuple>
            <atom name="Keys">362485</atom>
          </tuple>
          <tuple>
            <atom name="Keys">362486</atom>
          </tuple>
          <tuple>
            <atom name="Keys">362487</atom>
          </tuple>
          <tuple>
            <atom name="Keys">362488</atom>
          </tuple>
          <tuple>
            <atom name="Keys">362491</atom>
          </tuple>
          <tuple>
            <atom name="Keys">362492</atom>
          </tuple>
          <tuple>
            <atom name="Keys">362493</atom>
          </tuple>
          <tuple>
            <atom name="Keys">362494</atom>
          </tuple>
          <tuple>
            <atom name="Keys">362495</atom>
          </tuple>
          <tuple>
            <atom name="Keys">362496</atom>
          </tuple>
          <tuple>
            <atom name="Keys">362497</atom>
          </tuple>
          <tuple>
            <atom name="Keys">362498</atom>
          </tuple>
          <tuple>
            <atom name="Keys">362499</atom>
          </tuple>
          <tuple>
            <atom name="Keys">362500</atom>
          </tuple>
          <tuple>
            <atom name="Keys">362501</atom>
          </tuple>
          <tuple>
            <atom name="Keys">362502</atom>
          </tuple>
          <tuple>
            <atom name="Keys">362503</atom>
          </tuple>
          <tuple>
            <atom name="Keys">362505</atom>
          </tuple>
          <tuple>
            <atom name="Keys">362506</atom>
          </tuple>
          <tuple>
            <atom name="Keys">362507</atom>
          </tuple>
          <tuple>
            <atom name="Keys">362508</atom>
          </tuple>
          <tuple>
            <atom name="Keys">362509</atom>
          </tuple>
          <tuple>
            <atom name="Keys">362510</atom>
          </tuple>
          <tuple>
            <atom name="Keys">362511</atom>
          </tuple>
          <tuple>
            <atom name="Keys">362512</atom>
          </tuple>
          <tuple>
            <atom name="Keys">362513</atom>
          </tuple>
          <tuple>
            <atom name="Keys">362514</atom>
          </tuple>
          <tuple>
            <atom name="Keys">362516</atom>
          </tuple>
          <tuple>
            <atom name="Keys">362517</atom>
          </tuple>
          <tuple>
            <atom name="Keys">362518</atom>
          </tuple>
          <tuple>
            <atom name="Keys">362519</atom>
          </tuple>
          <tuple>
            <atom name="Keys">362520</atom>
          </tuple>
          <tuple>
            <atom name="Keys">362521</atom>
          </tuple>
          <tuple>
            <atom name="Keys">362522</atom>
          </tuple>
          <tuple>
            <atom name="Keys">362523</atom>
          </tuple>
          <tuple>
            <atom name="Keys">362524</atom>
          </tuple>
          <tuple>
            <atom name="Keys">362525</atom>
          </tuple>
          <tuple>
            <atom name="Keys">362526</atom>
          </tuple>
          <tuple>
            <atom name="Keys">362527</atom>
          </tuple>
          <tuple>
            <atom name="Keys">362528</atom>
          </tuple>
          <tuple>
            <atom name="Keys">362529</atom>
          </tuple>
          <tuple>
            <atom name="Keys">362530</atom>
          </tuple>
          <tuple>
            <atom name="Keys">362531</atom>
          </tuple>
          <tuple>
            <atom name="Keys">362532</atom>
          </tuple>
          <tuple>
            <atom name="Keys">362533</atom>
          </tuple>
          <tuple>
            <atom name="Keys">362534</atom>
          </tuple>
          <tuple>
            <atom name="Keys">362536</atom>
          </tuple>
          <tuple>
            <atom name="Keys">362537</atom>
          </tuple>
          <tuple>
            <atom name="Keys">362538</atom>
          </tuple>
          <tuple>
            <atom name="Keys">362539</atom>
          </tuple>
          <tuple>
            <atom name="Keys">362541</atom>
          </tuple>
          <tuple>
            <atom name="Keys">362542</atom>
          </tuple>
          <tuple>
            <atom name="Keys">362543</atom>
          </tuple>
          <tuple>
            <atom name="Keys">362544</atom>
          </tuple>
          <tuple>
            <atom name="Keys">362545</atom>
          </tuple>
          <tuple>
            <atom name="Keys">362546</atom>
          </tuple>
          <tuple>
            <atom name="Keys">362547</atom>
          </tuple>
          <tuple>
            <atom name="Keys">362548</atom>
          </tuple>
          <tuple>
            <atom name="Keys">362550</atom>
          </tuple>
          <tuple>
            <atom name="Keys">362551</atom>
          </tuple>
          <tuple>
            <atom name="Keys">362552</atom>
          </tuple>
          <tuple>
            <atom name="Keys">362553</atom>
          </tuple>
          <tuple>
            <atom name="Keys">362554</atom>
          </tuple>
          <tuple>
            <atom name="Keys">362555</atom>
          </tuple>
          <tuple>
            <atom name="Keys">362556</atom>
          </tuple>
          <tuple>
            <atom name="Keys">362557</atom>
          </tuple>
          <tuple>
            <atom name="Keys">362558</atom>
          </tuple>
          <tuple>
            <atom name="Keys">362559</atom>
          </tuple>
          <tuple>
            <atom name="Keys">362560</atom>
          </tuple>
          <tuple>
            <atom name="Keys">362561</atom>
          </tuple>
          <tuple>
            <atom name="Keys">362562</atom>
          </tuple>
          <tuple>
            <atom name="Keys">362563</atom>
          </tuple>
          <tuple>
            <atom name="Keys">362564</atom>
          </tuple>
          <tuple>
            <atom name="Keys">362565</atom>
          </tuple>
          <tuple>
            <atom name="Keys">362566</atom>
          </tuple>
          <tuple>
            <atom name="Keys">362567</atom>
          </tuple>
          <tuple>
            <atom name="Keys">362568</atom>
          </tuple>
          <tuple>
            <atom name="Keys">362569</atom>
          </tuple>
          <tuple>
            <atom name="Keys">362570</atom>
          </tuple>
          <tuple>
            <atom name="Keys">362571</atom>
          </tuple>
          <tuple>
            <atom name="Keys">362572</atom>
          </tuple>
          <tuple>
            <atom name="Keys">362573</atom>
          </tuple>
          <tuple>
            <atom name="Keys">362574</atom>
          </tuple>
          <tuple>
            <atom name="Keys">362575</atom>
          </tuple>
          <tuple>
            <atom name="Keys">362576</atom>
          </tuple>
          <tuple>
            <atom name="Keys">362577</atom>
          </tuple>
          <tuple>
            <atom name="Keys">362578</atom>
          </tuple>
          <tuple>
            <atom name="Keys">362579</atom>
          </tuple>
          <tuple>
            <atom name="Keys">362580</atom>
          </tuple>
          <tuple>
            <atom name="Keys">362581</atom>
          </tuple>
          <tuple>
            <atom name="Keys">362582</atom>
          </tuple>
          <tuple>
            <atom name="Keys">362583</atom>
          </tuple>
          <tuple>
            <atom name="Keys">362584</atom>
          </tuple>
          <tuple>
            <atom name="Keys">362585</atom>
          </tuple>
          <tuple>
            <atom name="Keys">362586</atom>
          </tuple>
          <tuple>
            <atom name="Keys">362587</atom>
          </tuple>
          <tuple>
            <atom name="Keys">362588</atom>
          </tuple>
          <tuple>
            <atom name="Keys">362589</atom>
          </tuple>
          <tuple>
            <atom name="Keys">362590</atom>
          </tuple>
          <tuple>
            <atom name="Keys">362591</atom>
          </tuple>
          <tuple>
            <atom name="Keys">362593</atom>
          </tuple>
          <tuple>
            <atom name="Keys">362594</atom>
          </tuple>
          <tuple>
            <atom name="Keys">362596</atom>
          </tuple>
          <tuple>
            <atom name="Keys">362597</atom>
          </tuple>
          <tuple>
            <atom name="Keys">362598</atom>
          </tuple>
          <tuple>
            <atom name="Keys">362599</atom>
          </tuple>
          <tuple>
            <atom name="Keys">362600</atom>
          </tuple>
          <tuple>
            <atom name="Keys">362601</atom>
          </tuple>
          <tuple>
            <atom name="Keys">362602</atom>
          </tuple>
          <tuple>
            <atom name="Keys">362603</atom>
          </tuple>
          <tuple>
            <atom name="Keys">362604</atom>
          </tuple>
          <tuple>
            <atom name="Keys">362606</atom>
          </tuple>
          <tuple>
            <atom name="Keys">362607</atom>
          </tuple>
          <tuple>
            <atom name="Keys">362608</atom>
          </tuple>
          <tuple>
            <atom name="Keys">362610</atom>
          </tuple>
          <tuple>
            <atom name="Keys">362611</atom>
          </tuple>
          <tuple>
            <atom name="Keys">362956</atom>
          </tuple>
          <tuple>
            <atom name="Keys">362957</atom>
          </tuple>
          <tuple>
            <atom name="Keys">362958</atom>
          </tuple>
          <tuple>
            <atom name="Keys">362959</atom>
          </tuple>
          <tuple>
            <atom name="Keys">362960</atom>
          </tuple>
          <tuple>
            <atom name="Keys">362961</atom>
          </tuple>
          <tuple>
            <atom name="Keys">362962</atom>
          </tuple>
          <tuple>
            <atom name="Keys">362963</atom>
          </tuple>
          <tuple>
            <atom name="Keys">362964</atom>
          </tuple>
          <tuple>
            <atom name="Keys">362965</atom>
          </tuple>
          <tuple>
            <atom name="Keys">362966</atom>
          </tuple>
          <tuple>
            <atom name="Keys">362967</atom>
          </tuple>
          <tuple>
            <atom name="Keys">362968</atom>
          </tuple>
          <tuple>
            <atom name="Keys">362969</atom>
          </tuple>
          <tuple>
            <atom name="Keys">362970</atom>
          </tuple>
          <tuple>
            <atom name="Keys">362971</atom>
          </tuple>
          <tuple>
            <atom name="Keys">362972</atom>
          </tuple>
          <tuple>
            <atom name="Keys">362973</atom>
          </tuple>
          <tuple>
            <atom name="Keys">362974</atom>
          </tuple>
          <tuple>
            <atom name="Keys">362975</atom>
          </tuple>
          <tuple>
            <atom name="Keys">362976</atom>
          </tuple>
          <tuple>
            <atom name="Keys">362977</atom>
          </tuple>
          <tuple>
            <atom name="Keys">362978</atom>
          </tuple>
          <tuple>
            <atom name="Keys">362979</atom>
          </tuple>
          <tuple>
            <atom name="Keys">362980</atom>
          </tuple>
          <tuple>
            <atom name="Keys">362981</atom>
          </tuple>
          <tuple>
            <atom name="Keys">362982</atom>
          </tuple>
          <tuple>
            <atom name="Keys">362983</atom>
          </tuple>
          <tuple>
            <atom name="Keys">362984</atom>
          </tuple>
          <tuple>
            <atom name="Keys">362985</atom>
          </tuple>
          <tuple>
            <atom name="Keys">362986</atom>
          </tuple>
          <tuple>
            <atom name="Keys">362987</atom>
          </tuple>
          <tuple>
            <atom name="Keys">362988</atom>
          </tuple>
          <tuple>
            <atom name="Keys">362989</atom>
          </tuple>
          <tuple>
            <atom name="Keys">362990</atom>
          </tuple>
          <tuple>
            <atom name="Keys">362991</atom>
          </tuple>
          <tuple>
            <atom name="Keys">362993</atom>
          </tuple>
          <tuple>
            <atom name="Keys">362994</atom>
          </tuple>
          <tuple>
            <atom name="Keys">362995</atom>
          </tuple>
          <tuple>
            <atom name="Keys">362996</atom>
          </tuple>
          <tuple>
            <atom name="Keys">362997</atom>
          </tuple>
          <tuple>
            <atom name="Keys">362998</atom>
          </tuple>
          <tuple>
            <atom name="Keys">362999</atom>
          </tuple>
          <tuple>
            <atom name="Keys">363000</atom>
          </tuple>
          <tuple>
            <atom name="Keys">363001</atom>
          </tuple>
          <tuple>
            <atom name="Keys">363002</atom>
          </tuple>
          <tuple>
            <atom name="Keys">363003</atom>
          </tuple>
          <tuple>
            <atom name="Keys">363004</atom>
          </tuple>
          <tuple>
            <atom name="Keys">363005</atom>
          </tuple>
          <tuple>
            <atom name="Keys">363006</atom>
          </tuple>
          <tuple>
            <atom name="Keys">363007</atom>
          </tuple>
          <tuple>
            <atom name="Keys">363008</atom>
          </tuple>
          <tuple>
            <atom name="Keys">363009</atom>
          </tuple>
          <tuple>
            <atom name="Keys">363011</atom>
          </tuple>
          <tuple>
            <atom name="Keys">363012</atom>
          </tuple>
          <tuple>
            <atom name="Keys">363013</atom>
          </tuple>
          <tuple>
            <atom name="Keys">363014</atom>
          </tuple>
          <tuple>
            <atom name="Keys">363016</atom>
          </tuple>
          <tuple>